{
  "schema": "sce.label-overlay.proposal.v1",
  "scope": {
    "namespace": "fixture-private",
    "profile_id": "fixture-profile",
    "project_ids": [
      "sce"
    ]
  },
  "overlay_id": "overlay-1",
  "revision_id": "overlay-1-r1",
  "subject_ref": {
    "schema": "sce.source-address.proposal.v1",
    "scope": {
      "namespace": "fixture-private",
      "profile_id": "fixture-profile",
      "project_ids": [
        "sce"
      ]
    },
    "source_id": "source-fixture-001",
    "original_revision_id": "original-fixture-001",
    "raw_sha256": "153bdf78adf1a725b2caf38fd8a9021d8f27c260adee38bc7e928625dc9cc197",
    "raw_size": 60,
    "coordinate": "RAW_BYTES",
    "start": 36,
    "end": 51,
    "range_sha256": "502988d16348f08ac9f5aa4afd504486c232eba9c91480d610c75bed46c5b7ea",
    "extraction_revision_id": null,
    "locator": null,
    "mapping_quality": "EXACT"
  },
  "facet": "topic",
  "value": "context",
  "author_kind": "USER",
  "producer_id": "operator-fixture",
  "producer_version": "1",
  "taxonomy_version": "1",
  "evidence_class": "MANUAL",
  "supporting_refs": [
    {
      "schema": "sce.source-address.proposal.v1",
      "scope": {
        "namespace": "fixture-private",
        "profile_id": "fixture-profile",
        "project_ids": [
          "sce"
        ]
      },
      "source_id": "source-fixture-001",
      "original_revision_id": "original-fixture-001",
      "raw_sha256": "153bdf78adf1a725b2caf38fd8a9021d8f27c260adee38bc7e928625dc9cc197",
      "raw_size": 60,
      "coordinate": "RAW_BYTES",
      "start": 36,
      "end": 51,
      "range_sha256": "502988d16348f08ac9f5aa4afd504486c232eba9c91480d610c75bed46c5b7ea",
      "extraction_revision_id": null,
      "locator": null,
      "mapping_quality": "EXACT"
    }
  ],
  "supersedes": null,
  "assigned_at": "2026-10-04T13:30:04Z"
}
